[2025-11-23T03:36:05.935Z] ℹ️ Starting automated test execution...
[2025-11-23T03:36:05.937Z] ℹ️ Total test cases: 10
[2025-11-23T03:36:05.937Z] ℹ️ API Base URL: http://localhost:3000
[2025-11-23T03:36:05.937Z] ℹ️ Output directory: /home/user/force/test-cases/bifurcation/outputs

[2025-11-23T03:36:05.937Z] ℹ️ 
Executing test 1/10...
[2025-11-23T03:36:05.937Z] ℹ️ 
================================================================================
[2025-11-23T03:36:05.937Z] ℹ️ Starting test case: TC-01 - Banking - Simple (Mobile App)
[2025-11-23T03:36:05.938Z] ℹ️ ================================================================================
[2025-11-23T03:36:05.938Z] ⏳ Uploading files for TC-01...
[2025-11-23T03:36:05.976Z] ✅ Job created: 3c76915c4e658b6e164d66e409f4ae89
[2025-11-23T03:36:05.982Z] ⏳ Job status: processing - Retrying AI request (attempt 2/3)...
[2025-11-23T03:36:07.987Z] ⏳ Job status: processing - Retrying AI request (attempt 3/3)...
[2025-11-23T03:36:09.990Z] ❌ Test case failed: fetch failed
[2025-11-23T03:36:09.991Z] ℹ️ Waiting 3 seconds before next test case...
[2025-11-23T03:36:12.991Z] ℹ️ 
Executing test 2/10...
[2025-11-23T03:36:12.991Z] ℹ️ 
================================================================================
[2025-11-23T03:36:12.991Z] ℹ️ Starting test case: TC-02 - Banking - Multi-source (Digital Lending)
[2025-11-23T03:36:12.991Z] ℹ️ ================================================================================
[2025-11-23T03:36:12.991Z] ⏳ Uploading files for TC-02...
[2025-11-23T03:36:12.998Z] ✅ Job created: 95e0e34789f7723162e56082cbe9206e
[2025-11-23T03:36:13.002Z] ⏳ Job status: processing - Generating chart data with AI...
[2025-11-23T03:36:15.006Z] ⏳ Job status: processing - Retrying AI request (attempt 3/3)...
[2025-11-23T03:36:17.010Z] ❌ Test case failed: fetch failed
[2025-11-23T03:36:17.010Z] ℹ️ Waiting 3 seconds before next test case...
[2025-11-23T03:36:20.012Z] ℹ️ 
Executing test 3/10...
[2025-11-23T03:36:20.012Z] ℹ️ 
================================================================================
[2025-11-23T03:36:20.012Z] ℹ️ Starting test case: TC-03 - Banking - Complex (Core Banking Modernization)
[2025-11-23T03:36:20.012Z] ℹ️ ================================================================================
[2025-11-23T03:36:20.012Z] ⏳ Uploading files for TC-03...
[2025-11-23T03:36:20.020Z] ✅ Job created: e22760c85559fbdff099682ebbade577
[2025-11-23T03:36:20.023Z] ⏳ Job status: processing - Retrying AI request (attempt 2/3)...
[2025-11-23T03:36:22.027Z] ⏳ Job status: processing - Retrying AI request (attempt 3/3)...
[2025-11-23T03:36:24.030Z] ❌ Test case failed: fetch failed
[2025-11-23T03:36:24.030Z] ℹ️ Waiting 3 seconds before next test case...
[2025-11-23T03:36:27.031Z] ℹ️ 
Executing test 4/10...
[2025-11-23T03:36:27.031Z] ℹ️ 
================================================================================
[2025-11-23T03:36:27.031Z] ℹ️ Starting test case: TC-04 - Healthcare - Simple (Telemedicine)
[2025-11-23T03:36:27.031Z] ℹ️ ================================================================================
[2025-11-23T03:36:27.031Z] ⏳ Uploading files for TC-04...
[2025-11-23T03:36:27.035Z] ✅ Job created: 97755421394444c2863f2ed01f292fa8
[2025-11-23T03:36:27.039Z] ⏳ Job status: processing - Generating chart data with AI...
[2025-11-23T03:36:29.042Z] ⏳ Job status: processing - Retrying AI request (attempt 3/3)...
[2025-11-23T03:36:31.045Z] ❌ Test case failed: fetch failed
[2025-11-23T03:36:31.045Z] ℹ️ Waiting 3 seconds before next test case...
[2025-11-23T03:36:34.046Z] ℹ️ 
Executing test 5/10...
[2025-11-23T03:36:34.047Z] ℹ️ 
================================================================================
[2025-11-23T03:36:34.047Z] ℹ️ Starting test case: TC-05 - Technology - Medium (AI Customer Service)
[2025-11-23T03:36:34.047Z] ℹ️ ================================================================================
[2025-11-23T03:36:34.047Z] ⏳ Uploading files for TC-05...
[2025-11-23T03:36:34.051Z] ✅ Job created: 0c4030212c1a4de688565b7443d52d31
[2025-11-23T03:36:34.055Z] ⏳ Job status: processing - Generating chart data with AI...
[2025-11-23T03:36:36.058Z] ⏳ Job status: processing - Retrying AI request (attempt 3/3)...
[2025-11-23T03:36:38.061Z] ❌ Test case failed: fetch failed
[2025-11-23T03:36:38.062Z] ℹ️ Waiting 3 seconds before next test case...
[2025-11-23T03:36:41.063Z] ℹ️ 
Executing test 6/10...
[2025-11-23T03:36:41.063Z] ℹ️ 
================================================================================
[2025-11-23T03:36:41.063Z] ℹ️ Starting test case: TC-06 - Finance - Simple (ESG Fund)
[2025-11-23T03:36:41.063Z] ℹ️ ================================================================================
[2025-11-23T03:36:41.063Z] ⏳ Uploading files for TC-06...
[2025-11-23T03:36:41.067Z] ✅ Job created: be30ab72d794f7751fa3a7f1bda75e50
[2025-11-23T03:36:41.070Z] ⏳ Job status: processing - Generating chart data with AI...
[2025-11-23T03:36:43.074Z] ⏳ Job status: processing - Retrying AI request (attempt 3/3)...
[2025-11-23T03:36:45.077Z] ❌ Test case failed: fetch failed
[2025-11-23T03:36:45.077Z] ℹ️ Waiting 3 seconds before next test case...
[2025-11-23T03:36:48.077Z] ℹ️ 
Executing test 7/10...
[2025-11-23T03:36:48.078Z] ℹ️ 
================================================================================
[2025-11-23T03:36:48.078Z] ℹ️ Starting test case: TC-07 - Banking - PDF Format (Branch Optimization)
[2025-11-23T03:36:48.078Z] ℹ️ ================================================================================
[2025-11-23T03:36:48.078Z] ⏳ Uploading files for TC-07...
[2025-11-23T03:36:48.082Z] ✅ Job created: 48a015cb077443ef1af44608a535d044
[2025-11-23T03:36:48.085Z] ⏳ Job status: processing - Generating chart data with AI...
[2025-11-23T03:36:50.088Z] ⏳ Job status: processing - Retrying AI request (attempt 3/3)...
[2025-11-23T03:36:52.091Z] ❌ Test case failed: fetch failed
[2025-11-23T03:36:52.091Z] ℹ️ Waiting 3 seconds before next test case...
[2025-11-23T03:36:55.092Z] ℹ️ 
Executing test 8/10...
[2025-11-23T03:36:55.092Z] ℹ️ 
================================================================================
[2025-11-23T03:36:55.092Z] ℹ️ Starting test case: TC-08 - Mixed Industries - High Complexity (Embedded Finance)
[2025-11-23T03:36:55.092Z] ℹ️ ================================================================================
[2025-11-23T03:36:55.092Z] ⏳ Uploading files for TC-08...
[2025-11-23T03:36:55.096Z] ✅ Job created: b5012f4fac3a1408d83b2ed6bc33886e
[2025-11-23T03:36:55.100Z] ⏳ Job status: processing - Generating chart data with AI...
[2025-11-23T03:36:57.103Z] ⏳ Job status: processing - Retrying AI request (attempt 3/3)...
[2025-11-23T03:36:59.108Z] ❌ Test case failed: fetch failed
[2025-11-23T03:36:59.108Z] ℹ️ Waiting 3 seconds before next test case...
[2025-11-23T03:37:02.108Z] ℹ️ 
Executing test 9/10...
[2025-11-23T03:37:02.108Z] ℹ️ 
================================================================================
[2025-11-23T03:37:02.109Z] ℹ️ Starting test case: TC-09 - Banking - Sparse Data (Credit Card Rewards)
[2025-11-23T03:37:02.109Z] ℹ️ ================================================================================
[2025-11-23T03:37:02.109Z] ⏳ Uploading files for TC-09...
[2025-11-23T03:37:02.113Z] ✅ Job created: 199f475be6d6fd899efa5f6597398fb5
[2025-11-23T03:37:02.116Z] ⏳ Job status: processing - Generating chart data with AI...
[2025-11-23T03:37:04.119Z] ⏳ Job status: processing - Retrying AI request (attempt 3/3)...
[2025-11-23T03:37:06.122Z] ❌ Test case failed: fetch failed
[2025-11-23T03:37:06.123Z] ℹ️ Waiting 3 seconds before next test case...
[2025-11-23T03:37:09.123Z] ℹ️ 
Executing test 10/10...
[2025-11-23T03:37:09.123Z] ℹ️ 
================================================================================
[2025-11-23T03:37:09.123Z] ℹ️ Starting test case: TC-10 - Banking - Contradictions (Small Business Lending)
[2025-11-23T03:37:09.123Z] ℹ️ ================================================================================
[2025-11-23T03:37:09.123Z] ⏳ Uploading files for TC-10...
[2025-11-23T03:37:09.128Z] ✅ Job created: 6956f76e916adfe9b6d1f655b952084a
[2025-11-23T03:37:09.130Z] ⏳ Job status: processing - Generating chart data with AI...
[2025-11-23T03:37:11.134Z] ⏳ Job status: processing - Retrying AI request (attempt 3/3)...
[2025-11-23T03:37:13.138Z] ❌ Test case failed: fetch failed
[2025-11-23T03:37:13.138Z] ℹ️ 
================================================================================
[2025-11-23T03:37:13.139Z] ℹ️ TEST EXECUTION SUMMARY
[2025-11-23T03:37:13.139Z] ℹ️ ================================================================================
[2025-11-23T03:37:13.139Z] ℹ️ Total test cases: 10
[2025-11-23T03:37:13.139Z] ⚠️ Successful: 0 (0.00%)
[2025-11-23T03:37:13.139Z] ❌ Failed: 10
[2025-11-23T03:37:13.139Z] ✅ Results saved to: /home/user/force/test-cases/bifurcation/test-execution-results.json
[2025-11-23T03:37:13.139Z] ✅ Outputs saved to: /home/user/force/test-cases/bifurcation/outputs
[2025-11-23T03:37:13.139Z] ❌ 
Failed test cases:
[2025-11-23T03:37:13.139Z] ❌   - TC-01: fetch failed
[2025-11-23T03:37:13.139Z] ❌   - TC-02: fetch failed
[2025-11-23T03:37:13.139Z] ❌   - TC-03: fetch failed
[2025-11-23T03:37:13.139Z] ❌   - TC-04: fetch failed
[2025-11-23T03:37:13.139Z] ❌   - TC-05: fetch failed
[2025-11-23T03:37:13.139Z] ❌   - TC-06: fetch failed
[2025-11-23T03:37:13.139Z] ❌   - TC-07: fetch failed
[2025-11-23T03:37:13.139Z] ❌   - TC-08: fetch failed
[2025-11-23T03:37:13.139Z] ❌   - TC-09: fetch failed
[2025-11-23T03:37:13.139Z] ❌   - TC-10: fetch failed
[2025-11-23T03:37:13.139Z] ℹ️ 
================================================================================

